{
  "$schema": "https://www.cs.odu.edu/~yasith/dfs/v2/dataset.schema.json",
  "info": {
    "version": "1.0.0",
    "timestamp": "2020-09-20T00:00:00",
    "checksum": "010203040506070809000A0B0C0D0E0F"
  },
  "name": "ADHD Audiovisual SIN Dataset",
  "description": "Gaze recordings of participants during an audiovisual SIN task",
  "keywords": [
    "SIN",
    "ADHD"
  ],
  "authors": [
    {
      "name": "Anne M. P. Michalek",
      "affiliation": "Old Dominion University",
      "email": "aperrott@odu.edu"
    }
  ],
  "sources": {
    "tobii": "../datasources/tobii_pro_x2_60.json"
  },
  "fields": {
    "RecordingTimestamp": "#/sources/tobii/fields/RecordingTimestamp",
    "GazePointLeftX (ADCSpx)": "#/sources/tobii/fields/GazePointLeftX (ADCSpx)",
    "GazePointLeftY (ADCSpx)": "#/sources/tobii/fields/GazePointLeftY (ADCSpx)",
    "PupilLeft": "#/sources/tobii/fields/PupilLeft",
    "GazePointRightX (ADCSpx)": "#/sources/tobii/fields/GazePointRightX (ADCSpx)",
    "GazePointRightY (ADCSpx)": "#/sources/tobii/fields/GazePointRightY (ADCSpx)",
    "PupilRight": "#/sources/tobii/fields/PupilRight"
  },
  "groups": {
    "subject": {
      "description": "The ID of each subject",
      "attributes": [
        "003",
        "012",
        "018",
        "024",
        "026",
        "030",
        "032",
        "034",
        "036",
        "038",
        "047"
      ]
    },
    "diagnosis": {
      "description": "The diagnosis of each subject",
      "attributes": [
        "ADHD",
        "NTYP"
      ]
    },
    "question": {
      "description": "The ID of in each question",
      "attributes": [
        "SET_A",
        "SET_B"
      ]
    },
    "noise": {
      "description": "The noise level of each question",
      "attributes": [
        "0",
        "5",
        "10",
        "15",
        "20",
        "25"
      ]
    }
  },
  "resolver": "adhd-sin.py"
}