{
  "$schema": "https://raw.githubusercontent.com/nirdslab/streaminghub/master/dfds/dataset.schema.json",
  "info": {
    "version": "1.0.0",
    "timestamp": "2020-09-20T00:00:00",
    "checksum": "010203040506070809000A0B0C0D0E0F"
  },
  "name": "dl_survey",
  "description": "Eye movements of participants during an audiovisual-SIN task",
  "keywords": [
    "SIN",
    "ADHD"
  ],
  "authors": [
    {
      "name": "Anne M. P. Michalek",
      "affiliation": "Old Dominion University",
      "email": "aperrott@odu.edu"
    }
  ],
  "sources": {
    "tobii": "../datasources/tobii_pro_x2_60.json"
  },
  "fields": {
    "t": "#/sources/tobii/fields/t",
    "x": "#/sources/tobii/fields/x",
    "y": "#/sources/tobii/fields/y",
    "d": "#/sources/tobii/fields/d"
  },
  "groups": {
    "subject": {
      "description": "The Group of Subjects",
      "attributes": [
        "multi1", "multi2", "multi3",
        "img1", "img2", "img3", "img4", "img5",
        "rtg1", "rtg2", "rtg3",
        "sng1", "sng2", "sng3", "sng4"
      ]
    },
    "diagnosis": {
      "description": "The diagnosis of each subject",
      "attributes": [
        "ADHD",
        "NTYP"
      ]
    },
    "question": {
      "description": "The ID of in each question",
      "attributes": [
        "SET_A",
        "SET_B"
      ]
    },
    "noise": {
      "description": "The noise level of each question",
      "attributes": [
        "0",
        "5",
        "10",
        "15",
        "20",
        "25"
      ]
    }
  },
  "resolver": "../resolvers/dl_survey.py"
}