{
  "$schema": "https://raw.githubusercontent.com/nirdslab/streaminghub/master/dfs/dataset.schema.json",
  "info": {
    "version": "1.0.0",
    "timestamp": "2020-09-20T00:00:00",
    "checksum": "010203040506070809000A0B0C0D0E0F"
  },
  "name": "adhd_sin",
  "description": "Eye movements of participants during an audiovisual-SIN task",
  "keywords": [
    "SIN",
    "ADHD"
  ],
  "authors": [
    {
      "name": "Anne M. P. Michalek",
      "affiliation": "Old Dominion University",
      "email": "aperrott@odu.edu"
    }
  ],
  "sources": {
    "tobii": "../datasources/tobii_pro_x2_60.json"
  },
  "fields": {
    "t": "#/sources/tobii/fields/t",
    "x": "#/sources/tobii/fields/x",
    "y": "#/sources/tobii/fields/y",
    "d": "#/sources/tobii/fields/d"
  },
  "groups": {
    "subject": {
      "description": "The ID of each subject",
      "attributes": [
        "003",
        "012",
        "018",
        "024",
        "026",
        "030",
        "032",
        "034",
        "036",
        "038",
        "047"
      ]
    },
    "diagnosis": {
      "description": "The diagnosis of each subject",
      "attributes": [
        "ADHD",
        "NTYP"
      ]
    },
    "question": {
      "description": "The ID of in each question",
      "attributes": [
        "SET_A",
        "SET_B"
      ]
    },
    "noise": {
      "description": "The noise level of each question",
      "attributes": [
        "0",
        "5",
        "10",
        "15",
        "20",
        "25"
      ]
    }
  },
  "resolver": "../resolvers/adhd_sin.py"
}