{
  "$schema": "https://raw.githubusercontent.com/nirdslab/streaminghub/master/dfs/dataset.schema.json",
  "info": {
    "version": "1.0.0",
    "timestamp": "2020-09-20T00:00:00",
    "checksum": "010203040506070809000A0B0C0D0E0F"
  },
  "name": "Weather Dataset",
  "description": "Weather Dataset",
  "keywords": [
    "Weather",
    "Climate"
  ],
  "authors": [
    {
      "name": "Gabriel Dzodom",
      "affiliation": "Texas A&M University",
      "email": "gabriel.dzodom@tamu.edu"
    },
    {
      "name": "Frank Shipman",
      "affiliation": "Texas A&M University",
      "email": "shipman@cse.tamu.edu"
    }
  ],
  "sources": {
    "weather": "../datasources/weather.json"
  },
  "fields": {
    "maxtemperature": "#/sources/weather/fields/maxtemperature",
    "meantemperature": "#/sources/weather/fields/meantemperature",
    "mintemperature": "#/sources/weather/fields/mintemperature",
    "maxdewpoint": "#/sources/weather/fields/maxdewpoint",
    "meandewpoint": "#/sources/weather/fields/meandewpoint",
    "mindewpoint": "#/sources/weather/fields/mindewpoint",
    "maxhumidity": "#/sources/weather/fields/maxhumidity",
    "meanhumidity": "#/sources/weather/fields/meanhumidity",
    "minhumidity": "#/sources/weather/fields/minhumidity",
    "maxsealevelpressure": "#/sources/weather/fields/maxsealevelpressure",
    "meansealevelpressure": "#/sources/weather/fields/meansealevelpressure",
    "minsealevelpressure": "#/sources/weather/fields/minsealevelpressure",
    "maxvisibility": "#/sources/weather/fields/maxvisibility",
    "meanvisibility": "#/sources/weather/fields/meanvisibility",
    "minvisibility": "#/sources/weather/fields/minvisibility",
    "maxwindspeed": "#/sources/weather/fields/maxwindspeed",
    "meanwindspeed": "#/sources/weather/fields/meanwindspeed",
    "maxgustspeed": "#/sources/weather/fields/maxgustspeed",
    "precipitation": "#/sources/weather/fields/precipitation",
    "cloudcover": "#/sources/weather/fields/cloudcover",
    "winddirection": "#/sources/weather/fields/winddirection",
    "date": "#/sources/weather/fields/date"
  },
  "groups": {
    "city": {
      "description": "The city of the corresponding weather data",
      "attributes": [
        "albuquerque",
        "atlanta",
        "billings",
        "boise",
        "boston",
        "buffalo",
        "charlotte",
        "chicago",
        "cleveland",
        "columbus",
        "dallas",
        "denver",
        "des moines",
        "detroit",
        "district of columbia",
        "el paso",
        "fargo",
        "indianapolis",
        "jackson",
        "jacksonville",
        "kansas city",
        "las vegas",
        "lincoln",
        "little rock",
        "los angeles",
        "louisville",
        "manhattan",
        "memphis",
        "miami",
        "milwaukee",
        "minneapolis",
        "missoula",
        "montgomery",
        "nashville",
        "new orleans",
        "oklahoma city",
        "philadelphia",
        "phoenix",
        "pittsburgh",
        "portland",
        "rapid city",
        "saint louis",
        "salt lake city",
        "san antonio",
        "san francisco",
        "seattle",
        "sioux falls",
        "spokane",
        "tucson"
      ]
    },
    "state": {
      "description": "The city of the corresponding weather data",
      "attributes": [
        "alabama",
        "arizona",
        "arkansas",
        "california",
        "colorado",
        "florida",
        "georgia",
        "illinois",
        "indiana",
        "iowa",
        "kentucky",
        "louisiana",
        "maine",
        "massachusetts",
        "michigan",
        "minnesota",
        "mississippi",
        "missouri",
        "montana",
        "nebraska",
        "nevada",
        "new mexico",
        "new york",
        "north carolina",
        "north dakota",
        "ohio",
        "oklahoma",
        "oregon",
        "pennsylvania",
        "south dakota",
        "tennessee",
        "texas",
        "utah",
        "washington",
        "washington dc",
        "wisconsin"
      ]
    }
  },
  "resolver": "../resolvers/pg_weather.py"
}