
{
  "$schema": "https://raw.githubusercontent.com/nirdslab/streaminghub/master/dfs/dataset.schema.json",
  "info": {
    "version": "1.0.0",
    "timestamp": "2020-09-20T00:00:00",
    "checksum": "010203040506070809000A0B0C0D0E0F"
  },
  "name": "N-Back Dataset",
  "description": "Eye movements of participants during a n-back task",
  "keywords": ["n-back"],
  "authors": [
    { "name": "Andrew T. Duchowski", "affiliation": "Clemson University", "email": "duchowski@clemson.edu" }
  ],
  "sources": {
    "eyelink": "../datasources/sr_research_eyelink_1000.json"
  },
  "fields": {
    "t": "#/sources/eyelink/fields/t",
    "x": "#/sources/eyelink/fields/x",
    "y": "#/sources/eyelink/fields/y",
    "d": "#/sources/eyelink/fields/d"
  },
  "groups": {
    "subject": {
      "description": "The ID of each subject",
      "attributes": [
        "S1", "S2", "S3", "S4", "S5", "S6", "S7", "S8", "S9", "S10",
        "S11", "S12", "S13", "S14", "S15", "S16", "S17", "S18", "S19"
      ]
    },
    "mode": {
      "description": "The mode of experiment",
      "attributes": [ "baseline", "task" ]
    },
    "task": {
      "description": "The ID of the task",
      "attributes": [ "1back", "2back" ]
    },
    "position": {
      "description": "The position of each task",
      "attributes": [ "top_left", "top_right", "center", "bottom_left", "bottom_right"]
    }
  },
  "resolver": "n_back.py"
}

